{
  "name": "adx-mcp-server",
  "description": "A Model Context Protocol (MCP) server that enables AI assistants to query and analyze Azure Data Explorer databases through standardized interfaces.",
  "git_url": "https://github.com/pab1it0/adx-mcp-server",
  "author_github": "pab1it0",
  "category": "databases",
  "tags": [
    "adx",
    "enables",
    "assistants",
    "query",
    "analyze"
  ],
  "license": "MIT",
  "status": "active"
}