{
  "name": "CurlShot MCP",
  "description": "Hosted remote MCP server (streamable HTTP at https://curlshot.com/api/mcp) that lets AI agents take screenshots of public web pages as PNG, JPEG, WebP, PDF or a scrolling video. Tools: take_screenshot and list_devices. Free plan with 100 screenshots a month.",
  "git_url": "https://github.com/SergiuPogor/curlshot-mcp",
  "homepage": "https://curlshot.com",
  "author_github": "SergiuPogor",
  "category": "developer-tools",
  "tags": ["screenshot", "web", "browser", "pdf", "remote", "http"],
  "env_keys": [
    {
      "key": "CURLSHOT_API_KEY",
      "kind": "client",
      "description": "CurlShot API key, sent as Authorization: Bearer header by the MCP client"
    }
  ],
  "license": "MIT",
  "status": "active"
}
