{
  "name": "OzBridge",
  "description": "Bring Warp™ Oz™ to any IDE or agent via MCP — plus native @oz in VS Code Copilot Chat. OzBridge is an independent project and is not affiliated with, endorsed by, or sponsored by Warp.",
  "git_url": "https://github.com/sena-labs/OzBridge",
  "author_github": "sena-labs",
  "category": "communication",
  "tags": [
    "aiagents",
    "claudecode",
    "cloudagents",
    "codex",
    "copilot"
  ],
  "license": "MIT",
  "status": "active",
  "homepage": "https://marketplace.visualstudio.com/items?itemName=sena-labs.ozbridge"
}